{
  "$schema": "http://json-schema.org/draft-07/schema#",
  "definitions": {
    "CompensationPolicyTriggerV1": {
      "enum": [
        "mutation",
        "external_side_effect",
        "external_write"
      ],
      "type": "string"
    },
    "EffectObservationClassV1": {
      "enum": [
        "latency",
        "error_budget",
        "compensation",
        "monitoring"
      ],
      "type": "string"
    },
    "EffectPolicyRunModeV1": {
      "enum": [
        "shadow",
        "dry_run",
        "live"
      ],
      "type": "string"
    },
    "EffectPreflightCheckV1": {
      "enum": [
        "integrity",
        "admission",
        "reachability",
        "budget"
      ],
      "type": "string"
    }
  },
  "properties": {
    "allowed_run_modes": {
      "default": [],
      "items": {
        "$ref": "#/definitions/EffectPolicyRunModeV1"
      },
      "type": "array"
    },
    "block_live_without_commit": {
      "type": "boolean"
    },
    "effect_policy_profile_id": {
      "type": "string"
    },
    "required_observation_classes": {
      "default": [],
      "items": {
        "$ref": "#/definitions/EffectObservationClassV1"
      },
      "type": "array"
    },
    "required_preflight_checks": {
      "default": [],
      "items": {
        "$ref": "#/definitions/EffectPreflightCheckV1"
      },
      "type": "array"
    },
    "requires_compensation_plan_for": {
      "default": [],
      "items": {
        "$ref": "#/definitions/CompensationPolicyTriggerV1"
      },
      "type": "array"
    },
    "schema_version": {
      "type": "string"
    }
  },
  "required": [
    "block_live_without_commit",
    "effect_policy_profile_id",
    "schema_version"
  ],
  "title": "EffectPolicyProfileV1",
  "type": "object"
}
